{
  "$schema": "https://json-schema.org/draft/2020-12/schema",
  "$id": "urn:usf:schema:schema-registry",
  "title": "USF Schema Registry Schema",
  "description": "Draft JSON Schema for the USF Schema Registry (spec/registries/schema-registry.json). Validates the registry's identity envelope and its governed collections: schema entries, schema classes, schema lifecycle states, schema families, and external standards. As the singleton registry's self-validation target, the identity fields id, title, authorityLevel, and foundationalSequencePosition are pinned with const. Each schema entry must record taxonomyRefs and vocabularyRefs (its taxonomy/vocabulary dependencies). Enforces schema classes from schema-classes, lifecycle states from schema-lifecycle-states, and authority roles from authority-levels. Governs the ontology concepts Registry and Validator. CLOSURE POLICY: the governed collections (schemas, schemaClasses, schemaLifecycleStates, schemaFamilies, externalStandards) and the top-level object are closed; descriptive metadata blocks (identityNotes, currentRepositoryState, governance, namingConventions, commonRequirements, commonEnvelope, reactSourceLearnings, deferredWork, acceptanceCriteria) are deliberately-open extension points typed permissively in this draft and documented as such. ENFORCEMENT SCOPE: shape and enum constraints only; cross-record checks (unique schema ids/paths, no schema 'active' without an existing validator-checkable file, forbidden-token scanning, schema/registry lifecycle-vs-file-existence consistency) are NOT expressible in plain JSON Schema and are documented validator responsibilities deferred per schema-authoring-standard section 24. lifecycleState draft; not active.",
  "type": "object",
  "$defs": {
    "kebabName": {
      "type": "string",
      "pattern": "^[a-z0-9]+(-[a-z0-9]+)*$"
    },
    "noForbiddenToken": {
      "$comment": "Forbidden canonical tokens per docs/architecture/directory-and-file-naming-standard.md section 18.",
      "not": {
        "pattern": "(^|[-./])(v2|legacy|old|new|temp|transitional)([-./]|$)"
      }
    },
    "schemaClass": {
      "$comment": "Canonical values only (no aliases) from the vocabulary catalogue value set 'schema-classes'.",
      "type": "string",
      "enum": [
        "governance-schema",
        "semantic-schema",
        "evidence-schema",
        "source-reference-schema",
        "registry-schema",
        "taxonomy-schema",
        "vocabulary-schema",
        "adr-schema",
        "validator-report-schema",
        "proof-schema",
        "provider-schema",
        "environment-schema",
        "command-schema",
        "configuration-schema",
        "interface-schema",
        "event-schema",
        "workflow-schema",
        "observability-schema",
        "audit-schema",
        "ui-semantic-schema",
        "import-manifest-schema"
      ]
    },
    "schemaLifecycleState": {
      "$comment": "Canonical values only (no aliases) from the vocabulary catalogue value set 'schema-lifecycle-states'.",
      "type": "string",
      "enum": [
        "proposed",
        "planned",
        "draft",
        "active",
        "deprecated",
        "retired",
        "replaced",
        "deferred"
      ]
    },
    "authorityLevel": {
      "$comment": "Canonical values only (no aliases; e.g. usf-semantic-definition is an alias and is NOT accepted) from the vocabulary catalogue value set 'authority-levels'.",
      "type": "string",
      "enum": [
        "semantic-definition",
        "adr",
        "validator-rule",
        "runtime-proof-evidence",
        "source-implementation",
        "historical-source-evidence",
        "generated-report"
      ]
    },
    "schemaEntry": {
      "type": "object",
      "additionalProperties": false,
      "required": [
        "id",
        "title",
        "path",
        "class",
        "family",
        "lifecycleState",
        "status",
        "governsOntologyConcepts",
        "taxonomyRefs",
        "vocabularyRefs",
        "authorityRole",
        "purpose",
        "requiredBecause",
        "expectedConsumers",
        "validationResponsibilities",
        "driftRisks",
        "aiGuidance"
      ],
      "properties": {
        "id": {
          "allOf": [
            {
              "type": "string",
              "pattern": "^[a-z0-9]+(-[a-z0-9]+)*\\.schema\\.json$"
            },
            {
              "$ref": "#/$defs/noForbiddenToken"
            }
          ]
        },
        "title": {
          "type": "string",
          "minLength": 1
        },
        "path": {
          "allOf": [
            {
              "type": "string",
              "pattern": "^spec/schemas/[a-z0-9]+(-[a-z0-9]+)*\\.schema\\.json$"
            },
            {
              "$ref": "#/$defs/noForbiddenToken"
            }
          ]
        },
        "class": {
          "$ref": "#/$defs/schemaClass"
        },
        "family": {
          "$ref": "#/$defs/kebabName"
        },
        "lifecycleState": {
          "$ref": "#/$defs/schemaLifecycleState"
        },
        "status": {
          "$ref": "#/$defs/schemaLifecycleState"
        },
        "governsOntologyConcepts": {
          "type": "array",
          "minItems": 1,
          "items": {
            "type": "string",
            "minLength": 1
          }
        },
        "purpose": {
          "type": "string",
          "minLength": 1
        },
        "requiredBecause": {
          "type": "string",
          "minLength": 1
        },
        "sourceInputs": {
          "type": "array",
          "items": {
            "type": "string",
            "minLength": 1
          }
        },
        "taxonomyRefs": {
          "type": "array",
          "minItems": 1,
          "items": {
            "$ref": "#/$defs/kebabName"
          }
        },
        "vocabularyRefs": {
          "type": "array",
          "minItems": 1,
          "items": {
            "$ref": "#/$defs/kebabName"
          }
        },
        "expectedConsumers": {
          "type": "array",
          "items": {
            "type": "string",
            "minLength": 1
          },
          "minItems": 1
        },
        "validationResponsibilities": {
          "type": "array",
          "items": {
            "type": "string",
            "minLength": 1
          },
          "minItems": 1
        },
        "authorityRole": {
          "$ref": "#/$defs/authorityLevel"
        },
        "driftRisks": {
          "type": "array",
          "items": {
            "type": "string",
            "minLength": 1
          },
          "minItems": 1
        },
        "aiGuidance": {
          "type": "string",
          "minLength": 1
        },
        "deferredDetails": {
          "type": "array",
          "items": {
            "type": "string",
            "minLength": 1
          }
        }
      }
    }
  },
  "required": [
    "id",
    "title",
    "status",
    "version",
    "authorityLevel",
    "purpose",
    "schemaClasses",
    "schemaLifecycleStates",
    "commonRequirements",
    "commonEnvelope",
    "schemaFamilies",
    "schemas",
    "validationExpectations",
    "aiAgentRules"
  ],
  "additionalProperties": false,
  "properties": {
    "$schema": {
      "type": [
        "string",
        "null"
      ]
    },
    "id": {
      "const": "usf.schema-registry"
    },
    "title": {
      "const": "USF Schema Registry"
    },
    "status": {
      "type": "string",
      "minLength": 1
    },
    "version": {
      "type": "string",
      "pattern": "^[0-9]+\\.[0-9]+\\.[0-9]+$",
      "minLength": 1
    },
    "authorityLevel": {
      "const": "semantic-definition"
    },
    "purpose": {
      "type": "string",
      "minLength": 1
    },
    "createdAfter": {
      "type": "array",
      "items": {
        "type": "string",
        "minLength": 1
      }
    },
    "consistentWith": {
      "type": "array",
      "items": {
        "type": "string",
        "minLength": 1
      }
    },
    "foundationalSequencePosition": {
      "const": 7
    },
    "normativeLanguage": {
      "type": "string"
    },
    "identityNotes": {
      "type": "object",
      "$comment": "Descriptive metadata; intentionally permissive in this draft."
    },
    "currentRepositoryState": {
      "type": "object",
      "$comment": "Descriptive metadata; intentionally permissive in this draft."
    },
    "governance": {
      "type": "object",
      "$comment": "Descriptive metadata; intentionally permissive in this draft."
    },
    "namingConventions": {
      "type": "object",
      "$comment": "Descriptive metadata; intentionally permissive in this draft."
    },
    "schemaClasses": {
      "type": "array",
      "minItems": 1,
      "items": {
        "type": "object",
        "additionalProperties": false,
        "required": [
          "id",
          "sourceValueSet",
          "description",
          "authorityRole",
          "expectedConsumers",
          "validationPurpose",
          "aiGuidance"
        ],
        "properties": {
          "id": {
            "$ref": "#/$defs/schemaClass"
          },
          "sourceValueSet": {
            "type": "string",
            "minLength": 1
          },
          "description": {
            "type": "string",
            "minLength": 1
          },
          "authorityRole": {
            "$ref": "#/$defs/authorityLevel"
          },
          "expectedConsumers": {
            "type": "array",
            "items": {
              "type": "string",
              "minLength": 1
            },
            "minItems": 1
          },
          "validationPurpose": {
            "type": "string",
            "minLength": 1
          },
          "aiGuidance": {
            "type": "string",
            "minLength": 1
          }
        }
      }
    },
    "schemaLifecycleStates": {
      "type": "array",
      "minItems": 1,
      "items": {
        "type": "object",
        "additionalProperties": false,
        "required": [
          "id",
          "sourceValueSet",
          "meaning",
          "allowedUse",
          "validatorExpectation",
          "aiGuidance",
          "referencesAllowed",
          "schemaFileRequired"
        ],
        "properties": {
          "id": {
            "$ref": "#/$defs/schemaLifecycleState"
          },
          "sourceValueSet": {
            "type": "string",
            "minLength": 1
          },
          "meaning": {
            "type": "string",
            "minLength": 1
          },
          "allowedUse": {
            "type": "string",
            "minLength": 1
          },
          "validatorExpectation": {
            "type": "string",
            "minLength": 1
          },
          "aiGuidance": {
            "type": "string",
            "minLength": 1
          },
          "referencesAllowed": {
            "type": "boolean"
          },
          "schemaFileRequired": {
            "type": "boolean"
          }
        }
      }
    },
    "commonRequirements": {
      "type": "object",
      "$comment": "Descriptive metadata; intentionally permissive in this draft."
    },
    "commonEnvelope": {
      "type": "object",
      "$comment": "Descriptive metadata; intentionally permissive in this draft."
    },
    "schemaFamilies": {
      "type": "array",
      "minItems": 1,
      "items": {
        "type": "object",
        "additionalProperties": false,
        "required": [
          "id",
          "purpose",
          "relatedOntologyConcepts",
          "relatedTaxonomyFamilies",
          "relatedTaxonomies",
          "relatedVocabularyValueSets",
          "expectedSchemas",
          "futureValidatorExpectations",
          "aiGuidance"
        ],
        "properties": {
          "id": {
            "$ref": "#/$defs/kebabName"
          },
          "purpose": {
            "type": "string",
            "minLength": 1
          },
          "relatedOntologyConcepts": {
            "type": "array",
            "items": {
              "type": "string",
              "minLength": 1
            },
            "minItems": 1
          },
          "relatedTaxonomyFamilies": {
            "type": "array",
            "items": {
              "type": "string",
              "minLength": 1
            },
            "minItems": 1
          },
          "relatedTaxonomies": {
            "type": "array",
            "items": {
              "type": "string",
              "minLength": 1
            },
            "minItems": 1
          },
          "relatedVocabularyValueSets": {
            "type": "array",
            "items": {
              "type": "string",
              "minLength": 1
            },
            "minItems": 1
          },
          "expectedSchemas": {
            "type": "array",
            "items": {
              "type": "string",
              "minLength": 1
            },
            "$comment": "May be empty: a family may have no expected schemas yet (e.g. foundation-governance). Items must be non-empty."
          },
          "reactSourceLearnings": {
            "type": "array",
            "items": {
              "type": "string",
              "minLength": 1
            }
          },
          "futureValidatorExpectations": {
            "type": "string",
            "minLength": 1
          },
          "aiGuidance": {
            "type": "string",
            "minLength": 1
          }
        }
      }
    },
    "schemas": {
      "type": "array",
      "minItems": 1,
      "items": {
        "$ref": "#/$defs/schemaEntry"
      }
    },
    "externalStandards": {
      "type": "array",
      "items": {
        "type": "object",
        "additionalProperties": false,
        "required": [
          "id",
          "status"
        ],
        "properties": {
          "id": {
            "$ref": "#/$defs/kebabName"
          },
          "status": {
            "type": "string",
            "minLength": 1
          },
          "affectsSchemas": {
            "type": "string"
          },
          "willNotClaimYet": {
            "type": "string"
          },
          "validatorImplications": {
            "type": "string"
          },
          "aiGuidance": {
            "type": "string"
          }
        }
      }
    },
    "reactSourceLearnings": {
      "type": "array",
      "$comment": "Descriptive metadata; intentionally permissive in this draft."
    },
    "validationExpectations": {
      "type": "array",
      "items": {
        "type": "string",
        "minLength": 1
      },
      "minItems": 1
    },
    "aiAgentRules": {
      "type": "array",
      "items": {
        "type": "string",
        "minLength": 1
      },
      "minItems": 1
    },
    "deferredWork": {
      "type": "array",
      "$comment": "Descriptive metadata; intentionally permissive in this draft."
    },
    "acceptanceCriteria": {
      "type": "array",
      "$comment": "Descriptive metadata; intentionally permissive in this draft."
    }
  }
}
