{
  "$schema": null,
  "id": "usf.schema-registry",
  "title": "USF Schema Registry",
  "status": "draft-foundational",
  "version": "0.3.0",
  "authorityLevel": "semantic-definition",
  "purpose": "Defines the canonical schema system for USF: which JSON Schemas are expected, why each exists, what ontology concept it governs, what taxonomy classifications and vocabulary value sets it depends on, what authority level it supports, and what lifecycle state it is in. It governs later schema creation so future schemas do not drift in naming, identity, metadata, references, authority, or enum values. It is machine-readable governance, not a schema file. The registry artefact itself authors no schema files; the schema files it catalogues are now present under spec/schemas/ as separate artefacts (lifecycleState draft), validated against spec/schemas/schema-registry.schema.json.",
  "createdAfter": [
    "docs/architecture/charter.md",
    "docs/architecture/authority-model.md",
    "docs/architecture/standards-profile.md",
    "docs/architecture/ontology.md",
    "spec/taxonomies/taxonomy-catalog.json",
    "spec/vocabularies/vocabulary-catalog.json"
  ],
  "consistentWith": [
    "docs/architecture/charter.md",
    "docs/architecture/authority-model.md",
    "docs/architecture/standards-profile.md",
    "docs/architecture/ontology.md",
    "spec/taxonomies/taxonomy-catalog.json",
    "spec/vocabularies/vocabulary-catalog.json"
  ],
  "foundationalSequencePosition": 7,
  "normativeLanguage": "Requirement words (MUST, MUST NOT, SHOULD, MAY) follow BCP 14 as defined in docs/architecture/standards-profile.md section 6. Only uppercase forms are normative.",
  "identityNotes": {
    "isSeventhFoundationalArtefact": true,
    "isDraftFoundational": true,
    "isMachineReadableGovernance": true,
    "isNotItselfASchemaFile": "This registry is governance data; it is not a JSON Schema. Its validating schema spec/schemas/schema-registry.schema.json has now been authored (lifecycleState draft) and the registry is checked against it for shape; enforcement remains advisory until a validator tool is integrated (active).",
    "createdBeforeActualSchemaFiles": true,
    "governsLaterSchemaCreation": true,
    "idPrefixNote": "This artefact uses the global artefact-ID namespace 'usf.' (id 'usf.schema-registry'), consistent with the taxonomy ('usf.taxonomy-catalog') and vocabulary ('usf.vocabulary-catalog') catalogues. The 'usf.' prefix is a deliberate globally-scoped machine-readable identifier namespace and is NOT a redundant-usf violation: the redundant-usf prohibition applies to repository path segments, package and implementation names, and unnecessary repeated local names, not to global artefact IDs that may be consumed outside the repository context. Schema file names and paths (e.g. spec/schemas/schema-registry.schema.json) remain unprefixed because they are paths, not global IDs."
  },
  "currentRepositoryState": {
    "taxonomyCatalogue": {"path": "spec/taxonomies/taxonomy-catalog.json", "exists": true, "parsed": true, "role": "Classification authority (taxonomy). Source of schema family taxonomy alignment and classification references."},
    "vocabularyCatalogue": {"path": "spec/vocabularies/vocabulary-catalog.json", "exists": true, "parsed": true, "role": "Controlled-value authority (vocabulary). Source of schema classes, schema lifecycle states, authority levels, and all enum value sets schemas must reference."},
    "schemaDirectory": {"path": "spec/schemas/", "exists": true, "authoredSchemaFilesPresent": true, "placeholderOnly": false, "note": "Contains 23 authored schema files, one per registry entry, all lifecycleState draft. No schema is active: active promotion additionally requires a formal active/enforcing validator posture. The current validator exists as draft/advisory CI enforcement (tools/validate-spec/validate-spec.py) and does not promote schemas to active."},
    "registryDirectory": {"path": "spec/registries/", "exists": true, "firstAuthoredRegistryArtefact": true, "note": "Contained only .gitkeep before this artefact."},
    "placeholderPolicy": {".gitkeep": "A git placeholder to retain an empty directory.", "isSemanticEvidence": false, "rule": "Placeholders MUST NOT be treated as authored artefacts."},
    "activeSchemaPolicy": "Schema files now exist for all 23 entries and are JSON Schema Draft 2020-12 meta-schema valid, so entries are lifecycleState draft. The draft/advisory validator tools/validate-spec/validate-spec.py is CI-enforced for the current corpus but does not activate schemas. No schema may be marked active until the validator posture is formally promoted to active/validator-enforced maturity.",
    "observation": "State observed during authoring; no wall-clock timestamp recorded because freshness of governance artefacts is tracked by commit."
  },
  "governance": {
    "belongsTo": "USF semantic definitions (Authority Model rank 1).",
    "valueSourcePolicy": "schemaClasses, schemaLifecycleStates, and authorityRole values are drawn only from the vocabulary catalogue. This registry introduces no new vocabulary values and no new taxonomy categories.",
    "rules": [
      "Schemas are machine-readable enforcement contracts.",
      "Schemas formalise parts of the ontology; they do NOT replace the ontology.",
      "Schemas MUST align with the taxonomy catalogue.",
      "Schemas MUST use controlled vocabulary values where available.",
      "Schemas MUST NOT duplicate vocabulary enum sets independently without referencing the vocabulary catalogue.",
      "Schema changes can alter semantic meaning and MAY require ADR review.",
      "Schema additions MUST identify the ontology concept they govern.",
      "Schema removals MUST include a disposition.",
      "Schema renames MUST preserve lineage.",
      "Schema IDs MUST be stable.",
      "Generated reports are not schema authority.",
      "../react source files are evidence, not future schema authority.",
      "Source paths from ../react MUST NOT dictate schema paths.",
      "Active schemas MUST exist and be validator-checkable.",
      "Planned schemas MAY be referenced but MUST NOT be enforced as if present.",
      "Schema registry changes MUST be reviewed as semantic-definition changes.",
      "Future AI agents MUST NOT create schemas opportunistically without a registry entry and rationale."
    ]
  },
  "namingConventions": {
    "schemaDirectory": "spec/schemas/",
    "filenameRule": "Schema files MUST live under spec/schemas/ and end with .schema.json.",
    "filenameSemantics": "Schema filenames MUST use stable semantic names describing the governed concept, not the producing tool.",
    "idRule": "Schema IDs MUST use stable semantic IDs and MUST NOT depend on ../react source paths.",
    "idNamespacePolicy": "Global, machine-readable artefact IDs MAY use the 'usf.' namespace (e.g. usf.schema-registry, usf.taxonomy-catalog, usf.vocabulary-catalog) because they may be consumed outside the repository context. The 'usf.' namespace on a global artefact ID is NOT a redundant-usf violation. The redundant-usf prohibition applies to repository path segments, package and implementation names, and unnecessary repeated local names and value IDs, never to deliberate globally scoped artefact-ID namespaces.",
    "lifecycleInPathRule": "Schema paths MUST NOT encode lifecycle state.",
    "historicalNamesRule": "Historical names from ../react MAY appear only as source references, aliases, or quoted evidence; never as canonical schema IDs, paths, or families.",
    "forbiddenCanonicalTerms": ["v2", "legacy", "old", "new", "temp", "transitional", "redundant-usf"],
    "allowedExceptions": ["historical source paths", "quoted source evidence", "source notes", "explicit historical aliases", "explanation of forbidden names", "the 'usf.' global artefact-ID namespace on machine-readable global identifiers (not a path segment or local value ID)"],
    "notAllowed": ["canonical schema IDs using forbidden terms", "canonical schema paths using forbidden terms", "canonical schema families using forbidden terms", "new target architecture paths using forbidden terms"]
  },
  "schemaClasses": [
    {"id": "governance-schema", "sourceValueSet": "schema-classes", "description": "Shapes governance and constitutional-adjacent artefacts (e.g. AI governance records).", "authorityRole": "semantic-definition", "expectedConsumers": ["validators", "AI agents", "governance reviewers"], "validationPurpose": "Enforce that governance artefacts carry required references and AI-alignment metadata.", "aiGuidance": "High authority; never weaken governance constraints."},
    {"id": "semantic-schema", "sourceValueSet": "schema-classes", "description": "Shapes rank-1 semantic contracts and capability/data semantics.", "authorityRole": "semantic-definition", "expectedConsumers": ["validators", "AI agents", "implementers"], "validationPurpose": "Enforce that semantic definitions are complete and evidence-backed.", "aiGuidance": "Defines intended behaviour; code conforms to it."},
    {"id": "evidence-schema", "sourceValueSet": "schema-classes", "description": "Shapes evidence envelopes across evidence kinds.", "authorityRole": "runtime-proof-evidence", "expectedConsumers": ["validators", "evidence collectors", "report generators"], "validationPurpose": "Enforce typed evidence with source, provider mode, environment, and freshness.", "aiGuidance": "Keep raw evidence; never overclaim readiness."},
    {"id": "source-reference-schema", "sourceValueSet": "schema-classes", "description": "Shapes references to historical/current source evidence and source dispositions.", "authorityRole": "historical-source-evidence", "expectedConsumers": ["validators", "import tooling", "AI agents"], "validationPurpose": "Enforce that every source reference resolves and carries a disposition.", "aiGuidance": "Lineage only; never live authority."},